[
  {"id":"psm1-q1","certification_id":"psm1","domain_id":"scrum-theory","question":"What are the three pillars of empirical process control in Scrum?","options":["Transparency, Inspection, Adaptation","Planning, Execution, Review","Vision, Mission, Goals","Design, Develop, Deploy"],"correct_index":0,"explanation":"The three pillars of empiricism are transparency (everyone sees the same picture), inspection (frequently inspect artefacts and progress), and adaptation (adjust when something is outside acceptable limits).","difficulty":1},
  {"id":"psm1-q2","certification_id":"psm1","domain_id":"scrum-theory","question":"What is the primary purpose of each Sprint in Scrum?","options":["To deliver a potentially releasable Increment","To complete all planned work","To satisfy the stakeholders","To demonstrate progress to management"],"correct_index":0,"explanation":"Each Sprint aims to create a 'Done', usable, and potentially releasable increment that meets the Sprint Goal.","difficulty":1},
  {"id":"psm1-q3","certification_id":"psm1","domain_id":"scrum-values","question":"Which Scrum value ensures team members are willing to pursue a Sprint Goal despite difficulties?","options":["Courage","Respect","Focus","Openness"],"correct_index":0,"explanation":"Courage means team members have the courage to do the right thing, tackle difficult problems, and pursue the Sprint Goal despite obstacles.","difficulty":1},
  {"id":"psm1-q4","certification_id":"psm1","domain_id":"scrum-team","question":"Who is responsible for maximising the value of the work the Development Team does?","options":["Product Owner","Scrum Master","Development Team","Project Manager"],"correct_index":0,"explanation":"The Product Owner is accountable for maximising the value of the product and the work of the Development Team.","difficulty":1},
  {"id":"psm1-q5","certification_id":"psm1","domain_id":"scrum-team","question":"What is the Scrum Master's primary responsibility regarding the Scrum Team?","options":["Coaching the team in Scrum and self-organisation","Assigning tasks to team members","Reporting progress to stakeholders","Managing the Product Backlog"],"correct_index":0,"explanation":"The Scrum Master is responsible for promoting and supporting Scrum, helping everyone understand Scrum theory, practices, rules, and values.","difficulty":1},
  {"id":"psm1-q6","certification_id":"psm1","domain_id":"scrum-events","question":"What is the maximum timebox for Sprint Planning for a one-month Sprint?","options":["8 hours","4 hours","2 hours","1 day"],"correct_index":0,"explanation":"For a one-month Sprint, Sprint Planning is timeboxed to a maximum of 8 hours. For shorter Sprints, it is proportionally shorter.","difficulty":1},
  {"id":"psm1-q7","certification_id":"psm1","domain_id":"scrum-events","question":"What is the purpose of the Daily Scrum?","options":["Inspect progress toward the Sprint Goal and adapt the Sprint Backlog","Report status to the Scrum Master","Update stakeholders on progress","Complete a status report"],"correct_index":0,"explanation":"The Daily Scrum is a 15-minute event for the Development Team to inspect progress toward the Sprint Goal and adapt the Sprint Backlog as necessary.","difficulty":1},
  {"id":"psm1-q8","certification_id":"psm1","domain_id":"scrum-artefacts","question":"Who owns the Product Backlog?","options":["Product Owner","Scrum Master","Development Team","Stakeholders"],"correct_index":0,"explanation":"The Product Owner owns the Product Backlog and is responsible for its content, ordering, and availability.","difficulty":1},
  {"id":"psm1-q9","certification_id":"psm1","domain_id":"scrum-artefacts","question":"What is the Definition of Done in Scrum?","options":["A formal description of the state of the Increment when it meets quality measures","A list of tasks for each Sprint","The acceptance criteria for user stories","A document signed off by the client"],"correct_index":0,"explanation":"The DoD is a formal description of the state of the Increment when it meets the quality measures required for the product.","difficulty":1},
  {"id":"psm1-q10","certification_id":"psm1","domain_id":"scrum-theory","question":"Scrum is built on which type of process control?","options":["Empirical","Defined","Waterfall","Lean"],"correct_index":0,"explanation":"Scrum uses empirical process control, which relies on the three pillars of transparency, inspection, and adaptation.","difficulty":1},
  {"id":"psm1-q11","certification_id":"psm1","domain_id":"scrum-values","question":"What does the Scrum value 'Focus' mean?","options":["Team members focus on the work of the Sprint and the goals of the Scrum Team","Focusing only on documentation","Focusing on management reporting","Focusing on individual tasks"],"correct_index":0,"explanation":"Focus means everyone concentrates on the work of the Sprint and the goals of the Scrum Team, avoiding distractions.","difficulty":2},
  {"id":"psm1-q12","certification_id":"psm1","domain_id":"scrum-team","question":"What is the recommended size of a Scrum Team?","options":["3-9 people","10-15 people","1-5 people","As many as needed"],"correct_index":0,"explanation":"The Scrum Team is typically 10 or fewer people. Small teams communicate better and are more productive.","difficulty":1},
  {"id":"psm1-q13","certification_id":"psm1","domain_id":"scrum-events","question":"What happens if a Sprint Goal becomes obsolete during the Sprint?","options":["The Sprint may be cancelled","The team continues regardless","The Scrum Master decides the new goal","The Product Backlog is reordered"],"correct_index":0,"explanation":"Only the Product Owner has the authority to cancel a Sprint, which would happen if the Sprint Goal becomes obsolete.","difficulty":2},
  {"id":"psm1-q14","certification_id":"psm1","domain_id":"scrum-artefacts","question":"What commitment does the Sprint Backlog provide?","options":["The Definition of Done for the Sprint","The Product Goal","The Sprint Goal","The project plan"],"correct_index":2,"explanation":"The Sprint Backlog commits to the Sprint Goal — a single objective for the Sprint.","difficulty":2},
  {"id":"psm1-q15","certification_id":"psm1","domain_id":"scrum-theory","question":"Which of the following is NOT a Scrum artefact?","options":["Project Charter","Product Backlog","Sprint Backlog","Increment"],"correct_index":0,"explanation":"The three Scrum artefacts are Product Backlog, Sprint Backlog, and Increment. The Project Charter is not a Scrum artefact.","difficulty":1},
  {"id":"psm1-q16","certification_id":"psm1","domain_id":"scrum-team","question":"Who decides how work is performed in a Sprint?","options":["Development Team","Scrum Master","Product Owner","Project Manager"],"correct_index":0,"explanation":"The Development Team is self-organising and decides how to turn Product Backlog items into Increments of value.","difficulty":1},
  {"id":"psm1-q17","certification_id":"psm1","domain_id":"scrum-events","question":"What is the purpose of the Sprint Retrospective?","options":["Plan ways to increase quality and effectiveness","Review what was delivered","Demonstrate the Increment to stakeholders","Prioritise the Product Backlog"],"correct_index":0,"explanation":"The Sprint Retrospective is an opportunity for the Scrum Team to inspect itself and create a plan for improvements to be enacted during the next Sprint.","difficulty":1},
  {"id":"psm1-q18","certification_id":"psm1","domain_id":"scrum-artefacts","question":"What is the Product Goal?","options":["A long-term objective for the Product Backlog","The goal for the current Sprint","The release target date","The project budget"],"correct_index":0,"explanation":"The Product Goal describes a future state of the product which can serve as a target for the Scrum Team to plan against.","difficulty":2},
  {"id":"psm1-q19","certification_id":"psm1","domain_id":"scrum-values","question":"Which Scrum value is demonstrated when team members trust each other to do the right work?","options":["Respect","Courage","Openness","Commitment"],"correct_index":2,"explanation":"Openness means the team and stakeholders agree to be open about all the work and the challenges with performing the work.","difficulty":2},
  {"id":"psm1-q20","certification_id":"psm1","domain_id":"scrum-events","question":"How long is the Sprint Review timebox for a one-month Sprint?","options":["4 hours","2 hours","8 hours","1 hour"],"correct_index":0,"explanation":"The Sprint Review is timeboxed to a maximum of 4 hours for a one-month Sprint.","difficulty":2},
  {"id":"pmi-acp-q1","certification_id":"pmi-acp","domain_id":"agile-principles","question":"According to the Agile Manifesto, which of the following is valued MOST?","options":["Individuals and interactions","Processes and tools","Comprehensive documentation","Contract negotiation"],"correct_index":0,"explanation":"The Agile Manifesto values individuals and interactions over processes and tools, working software over comprehensive documentation, customer collaboration over contract negotiation, and responding to change over following a plan.","difficulty":1},
  {"id":"pmi-acp-q2","certification_id":"pmi-acp","domain_id":"value-delivery","question":"What is the primary measure of progress in Agile projects?","options":["Working software delivered","Percentage of plan completed","Hours worked","Documents produced"],"correct_index":0,"explanation":"Agile projects measure progress primarily through delivery of working, valuable software to users.","difficulty":1},
  {"id":"pmi-acp-q3","certification_id":"pmi-acp","domain_id":"stakeholder-engagement","question":"How often should stakeholders be engaged in an Agile project?","options":["Continuously throughout the project","Only at project initiation","At the end of each phase","During quarterly reviews"],"correct_index":0,"explanation":"Agile emphasises continuous stakeholder engagement and collaboration throughout the project lifecycle.","difficulty":1},